{
  "schema_version": 1,
  "job_id": "pilot-local-001",
  "adapter": "local_file",
  "source": {
    "platform": "local",
    "source_kind": "video",
    "native_id": "pilot-local-001",
    "canonical_url": null,
    "title": "Pilot local source",
    "published_at": null,
    "access_state": "unknown"
  },
  "adapter_config": {
    "path": "/srv/himr-media/incoming/video.mp4",
    "expected_sha256": null,
    "expected_byte_count": null
  },
  "output": {
    "root": "/srv/himr-media/acquired"
  },
  "limits": {
    "max_job_bytes": 10737418240,
    "global_cache_cap_bytes": 53687091200,
    "free_space_floor_bytes": 85899345920
  }
}
